PT,AU,BA,BE,GP,AF,BF,CA,TI,SO,SE,BS,LA,DT,CT,CY,CL,SP,HO,DE,ID,AB,C1,RP,EM,RI,OI,FU,FX,CR,NR,TC,Z9,U1,U2,PU,PI,PA,SN,EI,BN,J9,JI,PD,PY,VL,IS,PN,SU,SI,MA,BP,EP,AR,DI,D2,EA,EY,PG,WC,SC,GA,UT,PM,OA,HC,HP,DA
J,"NEWELL, PH; KROUSKOP, TA; JENDRUCK.RJ; CHAKRABO.BK",,,,"NEWELL, PH; KROUSKOP, TA; JENDRUCK.RJ; CHAKRABO.BK",,,BIOMATERIALS FOR DIRECT SKELETAL ATTACHMENT,ABSTRACTS OF PAPERS OF THE AMERICAN CHEMICAL SOCIETY,,,English,Meeting Abstract,,,,,,,,,"TEXAS A&M UNIV,BIOENGN PROGRAM,COLLEGE STN,TX 77843",,,,,,,,0,0,0,1,1,AMER CHEMICAL SOC,WASHINGTON,"1155 16TH ST, NW, WASHINGTON, DC 20036",0065-7727,,,ABSTR PAP AM CHEM S,Abstr. Pap. Am. Chem. Soc.,,1973.0,,AUG26,,,,,44,44,,,,,,1,"Chemistry, Multidisciplinary",Chemistry,Q2957,WOS:A1973Q295701734,,,,,2019-02-25
J,"RATNER, BD; HOFFMAN, AS",,,,"RATNER, BD; HOFFMAN, AS",,,RADIATION GRAFTED HYDROGELS ON SILICONE-RUBBER AS NEW BIOMATERIALS,ABSTRACTS OF PAPERS OF THE AMERICAN CHEMICAL SOCIETY,,,English,Meeting Abstract,,,,,,,,,"UNIV WASHINGTON,DEPT CHEM ENGN,SEATTLE,WA 98195; UNIV WASHINGTON,DEPT BIOENGN,SEATTLE,WA 98195",,,,,,,,0,0,0,1,3,AMER CHEMICAL SOC,WASHINGTON,"1155 16TH ST, NW, WASHINGTON, DC 20036",0065-7727,,,ABSTR PAP AM CHEM S,Abstr. Pap. Am. Chem. Soc.,,1973.0,,AUG26,,,,,55,55,,,,,,1,"Chemistry, Multidisciplinary",Chemistry,Q2957,WOS:A1973Q295701745,,,,,2019-02-25
J,"DOSHI, GR; PATEL, B",,,,"DOSHI, GR; PATEL, B",,,ASHING PROCEDURES FOR VOLATILE ELEMENTS IN BIOMATERIALS,CURRENT SCIENCE,,,English,Article,,,,,,,,,"BHABHA ATOM RES CTR,HLTH PHYS DIV,BOMBAY 400085,INDIA",,,,,,,,7,6,6,0,2,CURRENT SCIENCE ASSN,BANGALORE,"C V RAMAN AVENUE, PO BOX 8005, BANGALORE 560 080, INDIA",0011-3891,,,CURR SCI INDIA,Curr. Sci.,,1973.0,42,9,,,,,307,309,,,,,,3,Multidisciplinary Sciences,Science & Technology - Other Topics,P4982,WOS:A1973P498200003,,DOAJ Gold,,,2019-02-25
J,"TURNER, JE; LAWRENCE, WH; AUTIAN, J",,,,"TURNER, JE; LAWRENCE, WH; AUTIAN, J",,,SUBACUTE TOXICITY TESTING OF BIOMATERIALS USING HISTOPATHOLOGIC EVALUATION OF RABBIT MUSCLE TISSUE,JOURNAL OF BIOMEDICAL MATERIALS RESEARCH,,,English,Article,,,,,,,,,"UNIV TENNESSEE,MED UNITS,COLL PHARM,MAT SCI TOXICOL LAB,MEMPHIS,TN 38103; UNIV TENNESSEE,MED UNITS,COLL DENT,MAT SCI TOXICOL LAB,MEMPHIS,TN 38103",,,,,,,,18,62,62,0,3,JOHN WILEY & SONS INC,NEW YORK,"605 THIRD AVE, NEW YORK, NY 10158-0012",0021-9304,,,J BIOMED MATER RES,J. Biomed. Mater. Res.,,1973.0,7,1,,,,,39,58,,10.1002/jbm.820070104,,,,20,"Engineering, Biomedical; Materials Science, Biomaterials",Engineering; Materials Science,P2473,WOS:A1973P247300002,4691156.0,,,,2019-02-25
J,"WILKES, GL; SAMUELS, SL",,,,"WILKES, GL; SAMUELS, SL",,,POROUS SEGMENTED POLYURETHANES - POSSIBLE CANDIDATES AS BIOMATERIALS,JOURNAL OF BIOMEDICAL MATERIALS RESEARCH,,,English,Article,,,,,,,,,"PRINCETON UNIV,DEPT CHEM ENGN,PRINCETON,NJ 08540",,,,"Samuels, Sam/0000-0002-2916-9534",,,,16,25,25,0,4,JOHN WILEY & SONS INC,NEW YORK,"605 THIRD AVE, NEW YORK, NY 10158-0012",0021-9304,,,J BIOMED MATER RES,J. Biomed. Mater. Res.,,1973.0,7,6,,,,,541,554,,10.1002/jbm.820070606,,,,14,"Engineering, Biomedical; Materials Science, Biomaterials",Engineering; Materials Science,R8077,WOS:A1973R807700004,4770937.0,,,,2019-02-25
J,"WHALEN, RL; JEFFERY, DL; NORMAN, JC",,,,"WHALEN, RL; JEFFERY, DL; NORMAN, JC",,,NEW METHOD OF IN VIVO SCREENING OF THROMBORESISTANT BIOMATERIALS UTILIZING FLOW MEASUREMENT,TRANSACTIONS AMERICAN SOCIETY FOR ARTIFICIAL INTERNAL ORGANS,,,English,Article,,,,,,,,,"BOSTON UNIV,SCH MED,DEPT SURG,BOSTON,MA 02118; BOSTON UNIV,SCH MED,DEPT PHYSIOL,BOSTON,MA 02118; HARVARD UNIV,MED SCH,SEARS SURG RES LABS,BOSTON,MA",,,,,,,,17,12,12,1,1,GEORGETOWN UNIV MED CENTER,WASHINGTON,"DR GEORGE SCHREINER ROOM 2212 GEORGETOWN UNIV HOSP, WASHINGTON, DC 20007",0066-0078,,,T AM SOC ART INT ORG,,,1973.0,19,,,,,,19,23,,,,,,5,"Engineering, Biomedical; Surgery",Engineering; Surgery,Q3277,WOS:A1973Q327700004,4269175.0,,,,2019-02-25
